{
  "schemaVersion": "0.1.0",
  "id": "scenario.ladle-cycle-synthetic",
  "name": "Synthetic preheat, fill, hold, and tap cycle",
  "time": {
    "timeStepSeconds": 60,
    "stepCount": 120
  },
  "series": [
    {
      "id": "process-mode",
      "name": "Process mode",
      "unit": "mode-code",
      "data": {
        "kind": "inline",
        "values": [
          1, 1, 1, 1, 1, 1, 1, 1, 1, 1,
          1, 1, 1, 1, 1, 1, 1, 1, 1, 1,
          1, 1, 1, 1, 1, 1, 1, 1, 1, 1,
          2, 2, 2, 2, 2, 2, 2, 2, 2, 2,
          3, 3, 3, 3, 3, 3, 3, 3, 3, 3,
          5, 5, 5, 5, 5, 5, 5, 5, 5, 5,
          5, 5, 5, 5, 5, 5, 5, 5, 5, 5,
          5, 5, 5, 5, 5, 5, 5, 5, 5, 5,
          5, 5, 5, 5, 5, 5, 5, 5, 5, 5,
          4, 4, 4, 4, 4, 4, 4, 4, 4, 4,
          0, 0, 0, 0, 0, 0, 0, 0, 0, 0,
          0, 0, 0, 0, 0, 0, 0, 0, 0, 0
        ]
      }
    },
    {
      "id": "historical-burner-output",
      "name": "Historical burner heat target",
      "unit": "kW",
      "data": {
        "kind": "inline",
        "values": [
          400, 400, 400, 400, 400, 400, 400, 400, 400, 400,
          400, 400, 400, 400, 400, 400, 400, 400, 400, 400,
          400, 400, 400, 400, 400, 400, 400, 400, 400, 400,
          0, 0, 0, 0, 0, 0, 0, 0, 0, 0,
          0, 0, 0, 0, 0, 0, 0, 0, 0, 0,
          0, 0, 0, 0, 0, 0, 0, 0, 0, 0,
          0, 0, 0, 0, 0, 0, 0, 0, 0, 0,
          0, 0, 0, 0, 0, 0, 0, 0, 0, 0,
          0, 0, 0, 0, 0, 0, 0, 0, 0, 0,
          0, 0, 0, 0, 0, 0, 0, 0, 0, 0,
          0, 0, 0, 0, 0, 0, 0, 0, 0, 0,
          0, 0, 0, 0, 0, 0, 0, 0, 0, 0
        ]
      }
    },
    {
      "id": "material-inflow",
      "name": "Molten-metal inflow",
      "unit": "kg/s",
      "data": {
        "kind": "inline",
        "values": [
          0, 0, 0, 0, 0, 0, 0, 0, 0, 0,
          0, 0, 0, 0, 0, 0, 0, 0, 0, 0,
          0, 0, 0, 0, 0, 0, 0, 0, 0, 0,
          0, 0, 0, 0, 0, 0, 0, 0, 0, 0,
          10, 10, 10, 10, 10, 10, 10, 10, 10, 10,
          0, 0, 0, 0, 0, 0, 0, 0, 0, 0,
          0, 0, 0, 0, 0, 0, 0, 0, 0, 0,
          0, 0, 0, 0, 0, 0, 0, 0, 0, 0,
          0, 0, 0, 0, 0, 0, 0, 0, 0, 0,
          0, 0, 0, 0, 0, 0, 0, 0, 0, 0,
          0, 0, 0, 0, 0, 0, 0, 0, 0, 0,
          0, 0, 0, 0, 0, 0, 0, 0, 0, 0
        ]
      }
    },
    {
      "id": "material-outflow",
      "name": "Molten-metal outflow",
      "unit": "kg/s",
      "data": {
        "kind": "inline",
        "values": [
          0, 0, 0, 0, 0, 0, 0, 0, 0, 0,
          0, 0, 0, 0, 0, 0, 0, 0, 0, 0,
          0, 0, 0, 0, 0, 0, 0, 0, 0, 0,
          0, 0, 0, 0, 0, 0, 0, 0, 0, 0,
          0, 0, 0, 0, 0, 0, 0, 0, 0, 0,
          0, 0, 0, 0, 0, 0, 0, 0, 0, 0,
          0, 0, 0, 0, 0, 0, 0, 0, 0, 0,
          0, 0, 0, 0, 0, 0, 0, 0, 0, 0,
          0, 0, 0, 0, 0, 0, 0, 0, 0, 0,
          9.5, 9.5, 9.5, 9.5, 9.5, 9.5, 9.5, 9.5, 9.5, 9.5,
          0, 0, 0, 0, 0, 0, 0, 0, 0, 0,
          0, 0, 0, 0, 0, 0, 0, 0, 0, 0
        ]
      }
    },
    {
      "id": "ambient-temperature",
      "name": "Ambient temperature",
      "unit": "°C",
      "data": {
        "kind": "inline",
        "values": [
          20, 20, 20, 20, 20, 20, 20, 20, 20, 20,
          20, 20, 20, 20, 20, 20, 20, 20, 20, 20,
          20, 20, 20, 20, 20, 20, 20, 20, 20, 20,
          20, 20, 20, 20, 20, 20, 20, 20, 20, 20,
          20, 20, 20, 20, 20, 20, 20, 20, 20, 20,
          20, 20, 20, 20, 20, 20, 20, 20, 20, 20,
          20, 20, 20, 20, 20, 20, 20, 20, 20, 20,
          20, 20, 20, 20, 20, 20, 20, 20, 20, 20,
          20, 20, 20, 20, 20, 20, 20, 20, 20, 20,
          20, 20, 20, 20, 20, 20, 20, 20, 20, 20,
          20, 20, 20, 20, 20, 20, 20, 20, 20, 20,
          20, 20, 20, 20, 20, 20, 20, 20, 20, 20
        ]
      }
    }
  ]
}
